"","sentiment.score","ReviewContent","anger","anticipation","disgust","fear","joy","sadness","surprise","trust","negative","positive"
"2950",-4.25,"I bought this book mostly because it was compared to Gillian Flynn's 'Gone Girl'; totally wrong!  The comparison could not be more inaccurate.  If the goal of the author was to write a book on characters that the reader was unable to relate to, or create a tangle pathetic characters, then the goal was accomplished.The story was good, but the characters were so unlikable.  Rachel the alcoholic who just had to be a part of the investigation into Megan's disappearance that she lies to Megan's husband Scott about knowing Megan. Rachel's ex-husband Tom the manipulator along with Anna his new wife the neurotic, lives in the house Rachel lived in with Tom when they were married.  Megan, trying to forget a traumatic experience, sleeps around on her docile, colorless husband Scott. At one point in the book, I was hoping Rachel character would have been the one to die off, in one of her drunken stupors; her character was just too contemptible.I'm not saying don't read the book, I just could not justify the comparison with any of the characters from 'Gone Girl.'",2,2,4,3,3,4,1,2,10,6
"2951",-2.95,"the thing is, it is more about how jealous and an alcoholic the main character was than actually the story. You will read about how she HATES her ex's wife and how disgusting the character was than know about what's the story really is.For me, it was TOO dark, I highly don't recommend this :( watch the movie instead when it comes out, it will probably be bad too.",3,1,3,3,0,2,0,1,3,2
"2952",-2.8,"the pretense of this book being much like 'gone girl' and set against the backdrop of trains immediately caught my interest. Some parts of the story are perhaps a little far fetched and some may say predictable, but this book did not disappoint me. I felt Rachel was relatable with her poor choices and forgotten memories from excessive drinking, many of us readers have been there in the dark chapters of our lives. I will  definitely keep up with any other books by this author.",1,1,1,1,0,3,0,1,5,3
"2954",-0.75,"I felt this book and story line were tedious.  I became very bored and aggravated with the constant description of the main character's alcoholism.  I realize it was integral to the plot, but it became a character in the storyline.  If a person can wade through the first three quarters of the book, the last quarter is excellent.",2,0,1,1,1,1,0,2,3,3
"2956",-2,"Want to read a book where everyone sucks? Do you want to be in a bad mood just thinking about it? Then by all means, read this awful book!",2,0,2,2,0,2,0,0,2,0
"2966",-0.65,"So this book is actually really contagious.  It may be a slow read at the beginnig (for us that are pickey readers) but once it starts you're on the edge. You have to get to the end but then you may be afraid of not wanting the story to end. But this was a  really enjoyable read.",0,0,1,2,0,1,0,0,3,0
"2968",-1.85,"Gritty, dark and absolutely gripping. I was pretty much caught from the start. I suspected everyone so it was very well crafted and still couldn't confidently say who it was until it was revealed. There wasn't one really likeable character but it was the point and it made you suspect everyone. I felt sympathy for many and the author wrote in such a way that you could see why and how they became so unlikeable, pathetic and pitiful. written and intense!",1,2,2,2,2,3,1,3,3,4
"2982",-0.85,"After all the hype that I had been reading about this book,  I honestly expected to be more interested in finding out for myself what it was all about. I have it be honest. In my opinion it was simply boring. I found it very difficult to even become interested in it from the very beginning. Maybe it's just me, but the twists & turns of it all weren't exactly earth shattering. Quite predictable actually.",1,2,2,2,2,2,0,2,2,4
"2984",-0.15,"This tale delves into the lives of Rachel and people close to her. She is at the center of a murder, which she insisted on being a part of. Her character is in even, wholly unlikable at times other times somewhat sympathetic and thus weakens the overall story. Neither villain nor hero, Rachel's problematic story drives the narrative with speed, stops and slow points similar to the train she rides daily. Good, but not great.",1,3,1,3,3,2,3,4,2,5
"3008",-0.3,"The girl on the train is a book that will keep you on your toes the entire time!! The mystery and suspense in this novel is outstanding, never have I read a book as shocking as this! It will keep you guessing until the very end, and keep your mind in awe.",0,3,0,1,1,0,2,0,1,1
"3010",-2.75,"One of the best ways to build suspense and keep the reader wondering who the killer might be is through the device of the unreliable narrator. This book capitalizes on major characters who have seriously traumatic backgrounds and who are narrating their mistaken version of what is happening while trying to break through their foggy delusions. Somehow these narrators are sympathetic, too.",1,1,0,4,1,2,2,2,3,4
"3033",-5.55,"Terrible story.  Terrible characters.  Terrible plotting.  Not sure what all the hoopla is.  By the end, the reader is so turned off by all the characters, he/she could really give a crap who dies or lives or who the culprit is.  I fell for the hype and was gravely disappointed.  Felt like I was The Boy on the Trainwreck.",2,1,4,1,0,3,0,0,7,1
"3035",-1.15,"I cringed throughout so much of this novel because Hawkins writes in such a way that she reveals all of our deepest shames, our bad experiences, raw human thoughts. It is also why I couldn't put this book down. Give this a read! And definitely do it before you watch the movie",1,1,1,2,0,1,0,0,1,0
"3038",-1.3,"This thriller was a real page turner.  At first I had a little difficulty with the author changing the chapters with different women speaking, but realized this only enhanced the mystery behind who was the real killer.  The narrative also gave insight into problems associated with addiction, self esteem and paranoia.  I hope to read more by this author.  This novel would make a great motion picture film.",1,3,0,2,2,2,2,4,3,4
"3041",-0.25,"It was a little confusing at first. I wasn't aware that there were multiple Characters perspectives, but after I realized that it was month sailing! Let's just say it keeps you on your toes nearly the whole book and the ending....  Boy you don't see that coming!",0,1,1,0,0,0,0,0,1,0
"3047",-2.2,"Just took too long to get to anything significant happening. These people are all so scummy that I skipped to the end after page 147. Tom and Anna are the biggest sleezebags from the beginning and its actually really unbelievable that people like this actually exist. If you've ever been dumped after being cheated on, this book will do nothing but infuriate. I'm actually mad at my friend who suggested this and I won't ever forgive her for it.",1,1,1,1,1,1,0,1,2,2
"3050",-0.65,"I binge read this book and I don't regret the sleepless night. Every point of view and every chapter was so detailed it made me feel in it. Caught up in the drama. Just so simple and amazing I loved it. I recommend this to anyone who wants a thriller/twisted story.",0,0,0,0,0,1,0,1,1,1
"3051",-0.2,"Seriously, what a mess! It's like being a rubber necker passing by a horrific auto accident... you know you should just walk away, but you keep looking because you have to know what happened.  Well, now that I know, I'm glad it's over, and I'm definitely not watching the movie.",1,1,2,2,1,2,1,0,3,1
"3053",-2.75,"One of those overrated novels everyone reads. It is relentlessly dark. Every major character is morally empty: liars, cheaters, drunks. And, a killer. There's a surprise , of course. The plot twist is the reward for your slog through the novel, but you'll figure it out before the big reveal. So, even that seems hollow; formulaic.It's the kind of novel that makes you want to go to the liquor store, but not the nice one; the one in the sketchy neighborhood, by the railroad tracks. For cheap wine.",1,3,0,1,4,3,2,2,4,5
"3055",-0.4,"OK mystery, though, as a frequent mystery reader I figured some of it out before the big reveal.  I did get bored with all the first-person whining that went on among 3 different women, so I found myself skipping whole chunks of stream of consciousness writing to get to the action.",0,1,0,0,1,0,1,1,0,4
"3060",-2.1,"It started out ok, I was intrigued.  Up until about page 250 I was tired of hearing of the drinking problem and addiction to riding the train.  However once I arrived around page 250 I didn't put it down until it the as finished.  I could not really compare this to Gone Girl other than the twist of the story.  It did not knock my socks off and I wouldn't read it again, but it was most certainly not the worst novel I've ever read.",0,0,0,2,0,1,0,0,5,0
"3061",-1.25,"""The Girl on the Train"" was almost too much for me to read. The author's characterization is astounding. There we times when I wanted to shake the protagonist and slap her silly for being so annoying, but there were other times when I would see myself in her. This book is unlike most others because it leaves you with a weird intense feeling that is hard to describe.",4,1,3,2,3,1,3,2,6,2
"3064",-0.15,"I saw the trailer for this movie in the theater one day and decided to pick up the book. I could not put it down. I think I read through it in a day. Its a very gripping multiple narrative suspense thriller with plenty of twist and turns. It kept me on the edge of my seat up until the end.  A must read  !",0,1,0,1,0,0,1,0,0,1
"3068",-0.3,"Very monotonous, predictable read. Meanders around without ever really engaging the reader finishes as it started with an anti climatic end.",0,0,0,0,1,0,0,1,0,2
"3070",-1.25,"This book got off to a very slow start.  The alternating narrative added to the confusion.  However, after about a third of the way through I was totally engrossed.  Unfortunately I was able predict the outcome before it was revealed.  I also felt the author rushed the ending.  Was it a good read - of course.  Was it the caliber of ""Gone Girl"" as some have compared it to - no.  What both books had in common was two deranged female characters.",2,3,1,2,1,0,1,2,2,4
"3076",-4.7,"With the various narratives between three central female characters, the book has no problem grabbing your attention. But it begins to lag when Rachel's stupid decisions become tiresome. It's ok that she has flaws, being an alcoholic, but even in her sober right mind it's hard to like her because she's so pathetic and needy. Also it's frustrating when you've figured out the mystery long before the main character does. I was ready to be done when the killer started his: ""and now comes the point where I explain how I carried out my evil plan!"" monologue to the main character. It felt incredibly 1 dimensional and stale.",1,4,2,2,0,3,1,1,8,4
"3079",-1.85,"I enjoyed the book, but found that the main character was some what frustrating in that she continued to make her life miserable. It reaffirms that the problem with addition is that it affects all the people in ones life. Not just the addicts. this gave the book a dark tone.",1,0,1,1,1,3,0,1,2,2
"3083",-1.1,"Very disappointing read.  The four main characters seem to live in a vacumn with no clues for the reader about what motivates them.  Rachel, the main character is annoying and I could not muster up any empathy for her.  Flawed characters are often fascinating, but not in this story!",1,0,0,0,0,1,0,0,2,4
"3084",-0.1,"This book took a long time to really get to suspenseful and I would not consider it a thriller on any level. Most of the time is spent waiting for the main character to try to remember what happened on one of the many black out drunk episodes she experiences throughout most of the book.",0,2,0,0,0,1,0,1,2,2
"3085",-0.95,"Disappointed, after all the hype.  Not believable that the murdered girl should have her own chapter in which she describes her death.  The convention of alternating chapters where each of the three women describe  their lives did not amuse me.  I found it jerky and difficult to pay attention.  I only finished the novel because it was my book club's feature of the month.  Thin story and not of lasting value.  The three men were not likable.",2,3,2,2,3,2,1,2,3,6
"3106",-0.5,"Interesting storytelling method that really gets you engaged with the characters.  I really like the 'everything is not always as it seems' plot and inevitable clash of characters in the end.  It did get a bit tedious with the repeated Rachel insecurities and depression.",1,1,0,0,1,1,0,1,3,2
"3109",-0.3,"I felt torn between outrage of what effect alcohol has on our lives and the power that a man can have over a women. Is she too blame for letting herself sink into the comforting world of a strong man. Does alcohol create a bigger problem in an already existing problem. The answer is always yes but that doesn't mean you wouldn't go there in the same situation.The book had twists and turns in unexpected ways and I was captivated by the main character.",2,1,2,2,2,1,1,0,5,3
"3114",-1.5,"I took me a little bit to get into the book but after a few chapters I was hooked. You cannot help but feel sorry for Rachel and her depressing life. She's so drunk all of the time she doesn't know reality. What a huge plot twit keeping you guessing until the end. Loved it.",0,1,1,0,0,1,0,0,2,0
"3115",-1.85,"Gripping story, book counterpart to ""film noir,"" I guess is how I'd describe it.  I read this on my Kindle, and unfortunately the shift from one character's narrative to another's did not catch my attention until late in the story, because the name of the character providing the narration was so faintly imprinted at the top of that narrative, and that led to some confusion along the way.  Some readers will no doubt say that the saga is over-written and repetitive.  Still, the story has interesting twists and turns, and conveys a strong sense of what it's like to struggle with alcoholism and depression and the manner in which those maladies manifest themselves in relationships.  Of course, some potential readers might be put off by that.",3,2,1,4,1,5,2,3,6,5
"3116",-2.35,"Once I realized the unravelling of this mystery required the primary character to relive her frequent drunken black outs to determine real violence from fiction, I became quickly bored.  That's all this story was - a girl who gets blind drunk 5 days a week. looses her friends, her job and her husband. She holds no respect. In fact the bad guys do the bad things in front of her, knowing that she's too wasted to witness anything and would never be believed if she reported it.I kept hoping she would turn her life around and get sober - there was some hint of that at the end.  I enjoyed the second to last chapter when the 2 arch rivals join forces to take the creepy man down.",3,2,3,2,1,3,1,5,6,6
"3117",-2.8,"Wow! This book was amazing! I couldn't put it down and wanted to read it any chance I could. It was suspenseful! The main character, Rachel witnesses a couple outside their home every day from a stop on a train and becomes a bit obsessed with their lives. She names them and imagines what they are like. She envies them since her own marriage failed. The funny thing is, her exhusband remarried and lives right near this couple.  But then the lady she often sees, Megan, goes missing! It's a mystery and an obsession for Rachel. She gets to be a part of their lives through lies and her obsessive snooping. She is an unreliable narrator since she also has a bit of a problem with getting flat-out blackout no memory drunk. Such a treat to read. You will be bummed out once you finish it : (",1,3,1,3,2,3,3,3,4,3
"3119",-1.1,"The storyline of this book never uplifts you. It is all about how everybody lies about his/her past, cheats his / her lover or husband / wife, turns to jealousy, violence, over drinking. It can't even claim to be a study of character - it does not dig profoundly enough for it. Neither is it a real thriller - lacking the action and speed.So what is it ? What did the author seek to accomplish with this story ? What did she seek to teach us ? A mystery to me",2,3,1,2,3,2,2,4,4,7
"3120",-2,"Wow...I could not put this book down. Extremely well written and a fantastic plot. With all the mystery and suspense books out there obsessing on the serial killer, this was a refreshing change. After all this type of murder is much more common than serial killings. The plot and murder was so everyday and the characters could really be your neighbors.....and that's what make a good murder mystery very very scary. The fact that this could really happen to you or someone you know. Nothing is scarier or more realistic than "" heat of the moment"" anger and desperation.Not a bloody butchering with disgusting descriptions of body parts strewn hither and yon to add gruesomeness to the plot.Kudos to Paula Hawkins. The rest of the "" blood and guts"" genre are going to get a run for their money with this woman.",5,6,3,5,3,2,5,3,4,6
"3128",-0.8,"I could NOT stop consuming this book because it utterly consumed me every step of the way!!I kept thinking that I just KNEW ""who done it""...but that kept changing and then folding back over into itself again and again!!A MUST READ!!",0,0,0,0,0,0,0,0,0,0
"3131",-1,"A chaotic who-dun-it that still manages to be predictable. Kudos to the narrative writing style Of Paula Hawkins, which is pacey, blurry aND captivating at times. The book is a litle contrived by using unreliable point of narration in a rather obvious way. It is nevertheless worth the read",1,0,0,0,1,0,0,2,3,4
"3138",-0.45,"How do you even describe this?  Told from the POV of three different women, all flawed and, well, crazy. Well written and keeps you on the edge of your seat. The author uses some misdirection along the way along with unreliable narrators.This is probably the least coherent review I've ever written. Right now I just feel like I want to go shower to wash off the remnants of these people.",1,0,0,1,0,1,0,2,2,2
"3141",-0.7,"This mystery was told from the perspective of three women who were all living lives of quiet desperation, although outwardly two seemed to have perfect suburban lives.  It kept me speculating and wondering up to the last few chapters just how the violence really played out.  Couldn't stop reading it!",1,2,0,1,1,2,1,1,1,3
"3143",-5,"I knew this story was not going to be pretty; after all, the main character is a pathetic drunk and a compulsive liar.  Every person in this sordid little drama has something to hide, and the book is written in such a way that the hidden parts don't fit together 'til the very end. The rotating viewpoints got to be tedious and confusing, especially since I wasn't able to read many chapters at one sitting. If you read this novel as an e-book, the repeated chapter headings with the same names will make it difficult to keep your place in the story line. I agree with many other reviewers; there was not a single character in this book that had any redeeming qualities. That said, I can't say I hated it; they all got exactly what they deserved from each other, as a bunch of scheming, selfish, violent liars.",3,1,5,4,1,2,1,1,7,4
"3149",-1.5,"Twists and turns of unexpected measure.  I can't wait to see how the movie portrays this scandalous story, though I doubt it will do it justice.  Very enticing.  Was hard to put down and read smoothly.  Gave enough information without being boring or left feeling unfinished.",2,3,1,3,2,2,2,4,7,4
"3150",-0.55,"Enjoyed this well-paced thriller/chiller. It was well written and was voiced by 3 women, Rachel, a complete drunken mess of a woman, Megan, not much better who had serious issues other than alcoholism, and Anna, a pathetic Stepford Wife, only wanting to stand by her man. Not as good as Gone Girl, but a good psycho thriller, nonetheless.",1,1,4,1,1,3,1,1,5,1
"3151",-0.1,"A main character that was annoying and constantly made decisions that no normal human being would make...a side character that I'm still confused on what her purpose was... and another side character that actually has an interesting storyline,  she just barely got any spotlight.",1,0,0,0,0,0,0,1,1,2
"3155",-2.4,"It was a good start and it draws you in. My first thought was that it was a copy of the Gone Girl book- same tempo.  But by the middle of the book the characters are hard to relate to as the author, in pursuit of tension, keeps changing them from good to bad.  Oh, you thought this person was a good guy?  Well you were fooled, and now he's a bad guy.  It's a tactic you can use once but several times?  I got kind of bored with the back and forth and in the end you can't really relate to the characters anymore.  The lead character is kind of pathetic and starts to become tedious.  The ending is kind of ridiculous when the ""bad guy"" acts in a way I thought was not in keeping with the build-up of his character.  It is an ok beach read and some will probably like it but it's not a story you will remember after a few months.",3,3,3,1,3,2,1,3,5,5
"3156",-3,"Girl on the Train is the story of a brokenhearted young women  (Rachel) whose husband has left her for another women.  She seems to have lost control of every part of her life as she obsesses about it.  The pace is fast as we enter Rachel's  mind because of her obsessive compulsive circular thoughts.  There are three voices in this story which is good because one could get very tired of Rachel's chatter.  Going back and forth between these different voices builds suspense and we begin to wonder whose voice is the real story.  There are always questions.  First impressions do not last very long.  While I became tired of Rachel's angst, there was enough going on in this story to keep me turning the pages.  I would recommend this book for a good absorbing read.",0,4,0,1,2,1,3,3,2,4
"3161",-0.2,"Reminded me of Gone Girl in terms of a murder mystery that has characters that aren't very likable and you're never quite sure what to believe. It was a bit of a page turner as I did want to know whodunit, but by the end I just wanted to slap the main woman character...she bugged me so much!  I will say it was an interesting glimpse into the power of alcoholism and how easy it can be slip into it, but still, by the end, I really had no sympathy for her.",3,1,2,2,0,3,4,0,4,3
"3166",-0.45,"The book started well, but began to drag halfway through, and towards the end it was very tough slogging. I couldn't wait to be finished. One expects a good mystery story to build in suspense, not peter out as this book did . Character development is not necessarily an essential part of a mystery. Even so, the characters in this novel were annoying to hysterical, and I never cared what happened to them.",2,4,0,2,1,1,3,1,5,3
"3169",-0.25,"This book got rave reviews. A close friend and myself hated it. It drags on and on incessantly. I kept waiting for it to get good. It didn't!",1,1,1,0,3,0,2,3,1,3
"3174",-1.75,"This was a fairly well written thriller that sucks you in wanting to find out what really happened, so you keep reading until the bitter end even though you're not exactly enjoying it.  There is no one to care about because all the characters are utter miserable, wretched, repulsive people without a single redeeming quality.  I don't know if the reader is supposed to sympathize with any of the three women, but I sure as heck didn't.  The character that represents the main POV, Rachel Watson, is utterly stupid and just the worst.  So even though I was hooked into the mystery itself, I hated being in the heads of all three women because they were all horrible people.  The men were all one-dimensional as well, so I was not surprised when everything was finally revealed.",2,3,4,1,2,4,3,3,6,6
"3182",-1,"I had seen quite a bit about this book and was looking forward to reading it.  I'm sorry to say I was extremely disappointed.  I came close to putting it away several times, but it drives me crazy not to finish a book.  It crept in an excruciatingly slow and depressing way throughout the first half of the book.  There wasn't a single likable character, no one to pull for or with whom I could identify.  Again, it was extremely depressing.  The story finally started to move just past the halfway point, but even then, it was hard to be interested in the outcome because I just didn't care about the characters.  The premise of the story is interesting.  That's why I gave it 2 stars.",2,1,4,1,1,4,1,1,4,7
"3188",-0.2,"When you hear the term psychological thriller, it fits into a certain genre. The Girl on the Train pretty much is all about psychology. Told in the first person in the perspective of three women whose lives are inextricably intertwined through the men in their lives. The essence of the story is about emotional and psychological manipulation and the resultant self perception left at the end of it. I found the novel captivating and the whodunit side of it absorbing. There are questions asked throughout. Whose side is who on? Read it and find out, you won't be disappointed.",3,2,1,1,2,1,0,2,3,3
"3191",-0.5,"I did not like the characters.  The story dragged on until the very end.  So sorry I bought this book.",0,0,0,0,0,0,0,0,0,0
"3193",-0.15,"Sometimes a little hard to follow, each chapter is from a different persons point of view, which is why only 4 stars instead of 5.  However, it's one of those books, you just want to keep reading.  Took me only a few days to finish because I had a hard time putting it down.",0,1,0,0,0,0,0,0,0,1
