"","sentiment.score","ReviewContent","anger","anticipation","disgust","fear","joy","sadness","surprise","trust","negative","positive"
"2",-1.35,"There are no words for how much I loathed this book.  This was the first audiobook I ever listened to so not sure if something was lost in translation here, if I just disliked the narrators, or if it is truly the book I hated - but man oh man I hated this book and have no idea what the hype is about.  Maybe if I READ it I would have liked it better but none of the characters were likable, the narration was rote and emotionless, and the writing was so ... basic.  ""I sat on the bed.  I got off the bed.  I sat back on the bed.  I poured myself another drink,  I don't want to drink.  I can't stop myself.  I'm going to drink.""  Not a direct quote from the book but you get the picture.  I thought it went way longer than necessary.  I honestly can't figure out why everyone was in love with this book.",2,3,0,0,1,2,1,1,5,2
"4",-0.35,"Three disjointed characters for whom it's hard to feel sympathy or empathy as they are presented in such a superficial way you can't feel for any of them.Plot dragged on and ending was very unsubstantial - definitely not worth the ""Gone Girl"" comparisons.",0,0,0,0,0,1,0,0,1,3
"7",-2.4,"This was the most boring book I have ever read. According to my Kindle I managed 32% before I gave up. The character was lifeless, the story was lifeless and just meandered along at a snails pace. The premise was totally unbelievable unless the train moved at the same speed as the snail. No dialogue just endless narrative of something. Completely unreadable.",1,0,0,2,1,2,0,1,4,2
"9",-0.85,"Hmmmm, after everything I read and heard about this book, I expected to be unable to put it down. Sadly, I was only too happy to put it down -- if I could send it back and get a refund, I surely would!This is a story about a drunk and a hyper-sexed suburban housewife. First, a reader cannot really care about any of the sad and sick characters in the book; second, there is no suspense -- you know the plot line and conclusion within the first 100 pages; and third, a reader  has only one thing to sustain himself -- how long will it take the drunk to remember? It is a pointless story with prosaic prose (not a single highlighted sentence in my copy!) and paper-thin characters. II cannot think of a single redeeming quality about this book except that it did not go on any longer. Had it ended in the first 25 pages, I would have been grateful to the author for putting me out of my misery associated with buying this book!!Unless you are hankering to be bored or fall into a deep slumber while reading this book, do not buy or read it.",2,6,3,3,1,7,1,2,8,5
"17",-2.9,"I don't understand the hype around this book. I can't finish it, let alone recommend it. I've forced myself to read half of it, but have given up -  it's just too annoying. It is well-written from a technical standpoint, but just drags along, with the narrator droning on about her failed marriage, drinking problem and depression. I wouldn't want to put up with her in real life, so I certainly don't want to waste time reading about a fictional character like this. Maybe she shakes it off in the end, but I don't care enough to find out.",1,3,1,2,1,2,0,3,7,4
"23",-4.3,"I was intrigued by the beginning, but is anyone else seriously disappointed in the last 1/4 of the book?  SPOILER ALERT: Do not read further if you have not read the book!Really?  Two men on the same block who physically abuse the same two women in the same exact way?  It seems like there wasn't too much thought put into the male characters, and the last quarter of the book doesn't feel organic -- it feels contrived and forced.The female lead's actions at the end also make her incredibly stupid.  If you figure out that someone is a killer, you DO NOT physically go to that person's house and tell said murderer that you know what happened.  I can understand if these people were teenagers, but in their 30s?  Seriously?  Greatly disappointed.",3,1,3,3,0,4,0,0,6,2
"29",-1.6,"Rachel, still raw after her divorce, travels past her former home twice a day on the commuter train. She becomes interested in an ideal couple living in a house a few doors down from where she used to live, concocting an idyllic life for the two.  Then the wife disappears, and Rachel finds herself obsessed with the mystery -- where has she gone? What has happened? Can she help the grieving husband find answers and deflect suspicion away from him? Convinced she has seen things from the train that give her extra insight into the couple, she inserts herself into the investigation. Meanwhile Anna, Rachel's ex-husband's new wife, contributes to the narrative, giving us a different view of Rachel and her motives, and making no bones about the fact that she views Rachel's intervention as an attempt to stalk her family.  In chapters alternating between Anna, Rachel, and Megan, the woman who has disappeared from her perfect life, the book gives us 3 different points of view of the story -- none of which prepares  us for the book's shocking finale.",1,4,2,3,1,3,2,4,4,5
"32",-1.4,"I had to read this book for a book club. If you spend most of your time voyouristically watching the lives of others rather than living your own life, if you love drunks and the havoc they wreak in your life and their's, if you adore weak, pathetic women who climb into a bottle at the first inkling of duplicity by their husbands, if you have a soft spot for good looking psychopaths, if you keep falling for weak men, by golly this is the book for you. The three-way point of view is a stupid contrivance for a pathetic storyline. The only character I liked or respected was Evie. Although she had no dialogue, she had the good sense to remain quite at critical times in the story. If this is the best Paula Hopkins can write, she has my sympathy. And, if the next generation really is similar to these characters, then God help us all. We're doomed.",3,4,1,3,4,4,1,3,7,6
"35",-2.55,"Where do I begin? So, you have a women who's lost everything, fakes going to work, has a drinking problem, creates a story in her head about a couple she watches from a train, still obsesses over her ex-husband, claims to know the missing women in the story when she doesn't, starts seeing one of the suspects so she can try to be a private eye, sleeps with...Man, this women needs a life!I was super excited to check it out but quickly became extremly dissapointed. The pace was slow, the repitition was annoying, could had done without all the internal dialouge, the chronological order threw me off and as much as I wanted to I could not feel for any of the charcters.Sighs...",1,1,0,2,1,3,1,1,5,1
"36",-1.85,"Like the outdated train tracks that Rachel rides across every day, what was billed as interesting is actually tedious and boring.  The books repetitive plot devices have been done to death.  It doesn't even hold up well enough to be a guilty pleasure or a campy beach read.  Its not a particularly good escape because there is nothing about her world that makes you want to be there.  Rather the story grates on in an irritatingly self-absorbed fashion....much like Rachel making yet another justification to herself to have yet another drink or three.And ike a drunkard's ramble, the story stumbles around until it reaches the end with a final, unsastisfying, meh.",2,3,1,2,2,2,2,1,5,5
"41",-5.45,"You know those movies, where there is a perfectly normal character who then, in the final act,  is suddenly revealed to be a psychopath?  Who, instead of killing the person who has figured it out, incredulously decides to confess to them everything they did and why they did it?  It is that cliched plot device that gives the cornered ""good guy"" the opportunity and the time to thwart the ""bad guy.""  It is lazy and uninspired writing, and it left me feeling cheated.This book commits the cardinal sin of writing.  It tells the story instead of showing the story. I'd wait for the next train if I were you.",4,5,3,4,2,5,4,3,9,4
"42",-0.55,"I finally decided to start putting down the iPad and get back to print. This was one of 3 recent book orders. Love the story. The quality of the book and print is HORRIBLE! Not sure who's manufacturing but you should never use them. Print is so bad I can't read some pages. My eyes are bad enough, I don't need a book that creates double vision! Paper is not bound well. Book will surely fall apart before I'm done. How disappointing! But, this is a first so not giving up on print yet!",2,3,3,2,2,3,1,1,5,4
"43",-1.3,"I couldn't wait for this book to come out. It was such a disappointment. This was probably the darkest book I've ever read. Just when I thought It couldn't get any darker, it did. There were only five main characters. Not only were they all dysfunctional but it was hard to keep them straight. When the story was being told from each respective character's point of view, the writing tones were all the same and sometimes it was hard to determine who was actually doing the talking. But, I didn't give it up and finished it to its dark ending. There was absolutely no uplifting parts to tis book.",0,2,1,0,0,2,0,0,2,1
"46",-0.25,"I was really excited about this one, as so many people were raving over how good it was at the time I read it. Unfortunately I found it hard to get into – nothing much happened in the first 100 pages. Characters were too depressing and pathetic. Not really fond of novels where woman are written as victims who don’t do anything to help themselves, even when they start to figure out somethings wrong. Mystery wasn’t that clever or original. Liked her writing style so will try her next book, but hope it’s better than this one.",1,7,2,1,5,2,5,5,4,6
"49",-0.65,"I almost stopped reading it by chapter 3 - but it was suggested I finish it ""it will get better""  It didn't...was a waste of time and very disappointing.  A one star is too much for this.  I'd rather read a cereal box.",0,2,1,0,1,1,0,1,2,2
"52",-1.25,"There's nothing particular that I can point out about why I hated this book.  I did finish it, just because I wanted to find out if Rachel was truly as crazy as I thought she was (she is).  I bought this based on ""if you liked Gone Girl, you'll love this"".  The only thing this book has in common with Gone Girl is that the main character was absolutely batshit crazy.  She's developed, but predictable.  She continually gets drunk, feels bad about it, then makes the same mistakes over and over again.  She is continually abusing the people in her life who are just trying to help her.  The ending did take me by surprise for about 3 sentences, then I figured out exactly what was going to happen.  Again, this is by far not the worst book I've ever read, but don't plan to read anything Paula Hawkins ever writes again.",2,3,1,3,2,2,1,0,2,3
"57",-2.55,"The inner thoughts in this book are compelling narratives by women who act badly and hate themselves for it. Unremitting self-destructive thoughts, abuse of themselves and getting themselves abused by others, and alcohol dominate their lives. The plot  is a very intelligently constructed mystery that depends on these women being the way they are, and their struggles to escape their nature. A very satisfying read.",4,2,3,5,0,3,1,0,6,3
"60",-3.6,"Rachel, an obsessive alcoholic who has blackouts, is struggling with life after divorce and sinking further and further into oblivion.  She becomes involved in a missing person case that she witnesses from a train and the case gradually takes over her life.I was torn between giving this book five stars or one star.  Why?  Because, while it's clever, it was excruciatingly slow to get to the point.  It is told in the first person, in turns, by three women, all s-l-o-w-l-y painting a hazy picture of a puzzle that isn't explained until the very last pages. It was extremely frustrating and a few parts were borderline boring.However, I was fascinated by the author's stream-of-consciousness style even in the present tense, which I usually dislike.  There is virtually no dialogue for the first 30 pages, just rambling thoughts. The pace definitely picked up toward the end and got really exciting.  Then, I was hooked and couldn't turn the pages fast enough to discover the very satisfying conclusion.There is a very small cast of characters, none of whom are very likable, and yet the book held my interest throughout.  Something different.",3,3,2,4,3,3,3,3,10,7
"61",-3.65,"OK, I know it's only February, but I read a lot -- usually at least 3 to 6 books per month. I read this novel more slowly than normal, savoring the storyline, the prose, the character development. I found the concept of the storyline original and intriguing, the characters believable, and the ending surprising (so to the reviewer who expressed boredom and disappointment with an obvious conclusion, um, maybe you should be a detective or a mystery writer 'cuzl I so did not see that coming!) I was immediately drawn in and caught up in the story, and stayed up too late reading on more nights than is good for me if I want to keep my job. I found Ms. Harkins's writing entrancing, and even the shifting points of view and jumps back and forth in the chronology didn't bother me; rather they added a dimension of realism to the inevitable unreliability of multiple narratives.I'm not going to rehash the plot yet again. Yes, Rachel is a fall-down blackout lying drunk who's stalking her ex husband. Does that make her unsympathetic or unlikable? Maybe. She's also a disillusioned woman who has never fully dealt with devastating losses in her life. Which probably have contributed to her becoming a fall-down blackout lying drunk. (Yes, I know that's a sentence fragment.) Or, perhaps I just liked her because I used to be a fall-down blackout lying drunk with stalker tendencies. And, I guess the fact that I didn't foresee the ending can be attributed to brain damage from all that alcohol consumption.Anyway, I loved the book and didn't want it to end. I highly recommend it to fans of Gone Girl and The Husband's Secret. If you're an Alfred Hitchcock addict, as I am, I think you'll enjoy this novel.",5,7,5,2,3,7,5,10,11,11
"62",-1,"Hummmmmm. So many with the same title. Confusing and all the back many forth from one character to another.  I read it because of the movie....I like the UK setting and have been on the train...... a bit disappointed in this but stayed with it even though I had it figured out.",1,0,1,0,0,1,0,1,1,1
"68",-0.65,"This novel is written in first-person of three women, which provides the tension and perspective. The premise is engaging, and I was most intrigued by the insight it offers into the struggles of addiction. I have experienced the same cycling and thought patterns that the narrators are subjected to. The author either has been there herself, or is intimately acquainted with such persons.Though the story drags a bit occasionally, it will keep you reading to the end.",1,2,0,1,2,1,0,3,2,4
"71",-1,"I have only read about 22% and am so bored I have gone on to another book.  Sorry I bought this book",0,0,0,0,0,0,0,0,0,0
"73",-0.35,"Let me start by saying, I don't understand the hype of being riveting. Before you get upset, this is not a slam or bad review. I did rate it four stars! This is my honest review and I didn't find it riveting.I did, however, find that it was very well written and intriguing. I was about 3/4 of the way through the book before I something crucial clicked and once it did, it all made sense.It did take me several chapters to realize it was bouncing timeframes. I had gotten really confused until I went back and double checked the dates. Things fell into place better after that.I got quite angry at Rachel but that was the nature of her character. The book elicits most of the correct feelings and moods as it should but I wasn't riveted to it and it took me longer than it should have to read it. The one thing I didn't feel enough of, or any, was dread. There should have been a great deal of dreadful feelings with a sense of foreboding. It just want there for me, maybe I read too many suspense/mystery/thriller novels to truly appreciate this book.Those are my Novel Thoughts, though I can't guarantee a Happily Ever After.",6,8,4,7,3,5,4,4,9,7
"76",-13,"This is a story of nasty dudes and naive women. I loved it. It’s being compared to Gone Girl by Gillian Flynn, but that’s not a good comparison. They are both amazing in their own ways and for very different reasons. This book has so many questions that have to be answered. Is Megan dead or did she run away? Both are plausible. Why is Rachel so obsessed with her? Is it just her imagination? Why is Tom so passive of Rachel’s constant intrusions? Who is sleeping with who? Does Anna have any redeeming qualities?The characters are flawed and some are downright detestable. The story focuses on three women: Rachel, the drunk who can’t let go of her ex-husband, Anna, the one who stole him away, and Megan, the beautiful missing woman.Rachel was a great character to read. She is completely broken and her only escape is with alcohol. The story is told from first-person perspective and doesn’t have a whole lot of dialogue, so her chapters were desperate and lonely. I could put myself in her shoes. She is someone who is easy to pity, as she travels the train everyday, pretending to go to a job that she was fired from months ago. Every day she looks at a house, only a few down from where she once lived, and watches a loving couple. She creates a make-believe world around them, perfect in every way. It’s an obvious set-up for disappointment.Anna is not likeable. At no point in the book did I feel anything for her but contempt. She knowingly begins an affair with a married man, none other than Rachel’s husband Tom, and effectively steals him away. Granted, Rachel’s depression makes it easy for her. At one point, while she’s admiring her and Tom’s sleeping baby, she remembers the days of sneaking around with him and admits that she misses being a mistress. She loved the sense of danger and wishes she could go back to it. All she feels towards Rachel is disgust. She was a good chunk of the book and suffice it to say that her chapters filled me with my own sense of disgust, aimed at her.Next is Megan, the one I’m not sure how to feel about. Partly, she reminds me of Anna, with her “I don’t care about anyone but me” attitude, but she also reminds me of Rachel, with her struggle against depression and insomnia. Her tragic past is the only part of her character that I could stand, as the rest of the time she’s thinking purely about herself and her memories of when she ran an art gallery and had men drooling over her. Surely, she would be appalled to be compared to Rachel, who is described as being overweight, drunk, and repulsive. Megan’s selfishness is sometimes nauseating, but then a wee bit of humanity shines through. Ultimately, I felt sorry for her, but I didn’t like her.The men in the story are a puzzle. There’s good and bad. It’s a confusing mess and I wasn’t always sure which man I was reading about through these women’s thoughts. Have no fear, the book did not leave me with a total sense of hopelessness concerning men in general, even though the author did not show them in a positive light.It’s definitely a mystery. I had inklings all the way through, but it wasn’t until about seventy percent through that I said, “Ah-ha!” I’m always impressed with a book that can keep me guessing more than halfway through and this one definitely did. It wasn’t a huge surprise to me, but it was an unpleasant one. In the beginning, everything is up in the air. No one is safe from doubt, not even poor Rachel. Nothing is completely settled until the very end, as it should be, leading to a perfectly short and powerful climax.The end was fulfilling, yet a little disappointing. I do not like happy-happy endings, but this one lacked hope. It was hinted at, but only one of these women gets to speak and her thoughts are still terrified and troubled. I would have liked to see more resolution for her. As it was, it felt sort of incomplete. My takeaway is that everyone lives in their own distorted version of reality and when the truth shows up it can have devastating repurcussions. So, don’t lie and don ‘t cheat.For the rating:Genre and general reading age – it’s a mystery and thriller. Reading age is adult, due to some really difficult scenes and references, including excessive drinking by more than one of the characters. Sometimes I wondered how they were able to stand up.The level of sexuality – for the amount of cheating involved, it was surprisingly mild. There weren’t actual sex scenes, but memories of trysts and a morning after.Was there graphic language? Not much.Did I cry? Nope.Is it part of a series? Nope.Level of character development was very high. Out of the three men and three women who make up the story, only one was a bit weak. The others were strong and I could see them in my mind.Did I laugh? Nope.This was a fantastically-written story and once I picked it up I couldn’t put it down, literally. I stayed up late into the night with this one. I’m happy to give it <U+2B50><U+FE0F><U+2B50><U+FE0F><U+2B50><U+FE0F><U+2B50><U+FE0F>.5 stars. It was almost perfect.",16,14,15,19,15,22,9,25,36,33
"77",-2,"I didn't like this book. Sometimes less is more and it's annoying when a villain explains all their motives before they kill someone. Pretty much how this book ends and it reminded me of a silly scary movie.",1,1,0,2,2,1,0,1,4,1
"80",-0.35,"I was contemplating to skip this review. I don’t like to be negative, just because it may not be my cup of tea. In a real life I practice a rule, what I don’t understand, I simply respect, instead of judging it.This is a book review site, and I feel I have to stay true to its purpose.I was very excited to read this book after all the commercial hype about it. I have to admit that I set myself for a real disappointment. I will try to stay constructive and short.CONS:Title - The word ‘girl’ is completely wrong for a divorced thirty something WOMAN.Plot - Predictable, similar concept “Lady on the train” 1945.Characters - Three messed up women, two abusive men. All narrators speak in first person.Ending - Completely flat, fell apart.Pace - First half very slow.PROS:Writing - Paula Hawkins has a unique narrative structure.To me this wasn’t really a mystery, more like a character study. I don’t mind depressing, negative or dark, but non of the characters were likable enough to root for them.",0,4,2,1,2,5,3,8,7,11
"81",-1,"Fabulous. Long & slow going, actually, but every step of the way hypnotic. The tiny details of human character, that's what pulls you on. These characters at first seem so mundane & ordinary, but what explosions lie within each of them! This whole story is like the peeling of an onion, revealing more and more, until you don't want to look anymore, but are compelled to. Sensational!!",1,1,1,0,1,1,0,0,1,1
"82",-0.45,"I agree with some other reviewers. The characters in this novel were all annoying and not believable.  The main character, Rachel, you just want to reach out and smack some sense into her.  I just keep reading so I could be done with it. It is one crazy female after another, surrounded by awful men. I fail to see why this book is getting so many good reviews. Stay away.",4,1,1,2,1,2,1,1,4,6
"83",-0.15,"I still don't get it.  I tried to like this story because it was such a big best seller, but just couldn't get into it and was not at all drawn to any of the characters or their unique situations.  Probably the best part was the end, which exposed a maniacal killer.  I realize the narrative is British, but the author could use some grammar checks.",0,0,0,0,0,0,1,2,2,2
"90",-1.85,"I wonder if I was the only person who hoped that Rachel would also at some point, be murdered. She was almost unbearably pathetic and unfortunately without any other strong, likable characters I just found myself whipping through the book so I didn't have to be reading it anymore.",0,0,1,0,1,1,0,1,1,2
"92",-2.2,"How does a writer get me to feel empathy for a lying, busy-body, pathetic drunk? Rachel had a nice life in the suburbs until difficulty conceiving drove her to drink—in excess! To the point she lost everything. She’s obsessed with her ex, even though he has moved on with another wife and child. Now she’s become obsessed with a couple she sees from the commuter train. She’s given them names and created a fairy tale life for them. Until the day she sees something that shatters the illusion.This suspense has everything. The characters are well-developed; the pace moves along; there are plot twists throughout. It kept me guessing. This is a hard-to-put-down novel. I didn’t want it to end!",2,2,2,2,1,3,2,0,6,4
"94",-0.75,"Flat, predictable, poorly written. I'd have dropped it midbook (which I almost never do) had it not been part of a book club.",0,0,0,0,0,0,0,0,1,0
"96",-1.75,"Dull, tedious & the ""plot twist"" was yawn-inspiring. Let's just say I wasn't expecting a 300 page diary of a drunk woman.",0,1,0,0,1,1,0,1,3,1
"98",-0.8,"Not bad novel. Wanted to read it before watching the movie. After reading the book don't think I will bother watching the movie. Not my kind of story.",1,0,1,1,1,1,0,1,2,2
"99",-0.9,"It took quite an effort to get through it It really draggeedandwas depressing at least half way through it. After reading, I will skip the movie.",0,0,1,0,0,1,0,0,2,2
