"","sentiment.score","ReviewContent","anger","anticipation","disgust","fear","joy","sadness","surprise","trust","negative","positive"
"820",-1,"At first I thought, oh no, it's Gone Girl set outside of London. That comparison quickly faded as this book is actually better. The flawed main protagonist helps. Actually all the characters are flawed, rendering them both unreliable and sympathetic. This unreliability, drawn up through actual physical reasons for doubt to reasons of lies, emotional distance, and lack of information on a character serves as a constant feed for the tension and its consistent throughout all the diary-like entries.I generally dislike dates as chapter headings. It's just another thing to keep track of and my mind quickly reads over them (hence I forget them straight away) because I hurry right to the ""juicy stuff."" And this book has lots of juicy bits, but the dates ARE important and I made an effort to keep track.5 stars is not quite enough to give this book, I'd say 7-9 was closer out of an imaginary 10.",2,3,1,2,2,2,0,6,5,8
"821",-5.35,"I started this book a few months ago and put it away. A friend was reading it so I thought I would give it another try. Do not read this book if you're depressed or sad....the whole premise is sick and twisted.  It does depict the sadness and desperation of alcoholism- the total wasting away of someone life. This is not a summer beach read!  I think the author was channeling Gone Girl- no more depressing books for me.",2,1,4,3,2,6,0,3,6,3
"822",-1.25,"I thought this would be similar to the Alfred Hitchcock's ""Rear Window"" but I was wrong. This was a very black and depressing story. The main character was very unlike able and too much of the story was her imagination of events. I had a hard time getting thru the book and eventually decided not to finish reading it. I would not recommend it.",0,2,1,0,0,2,0,1,4,3
"828",-0.7,"I forced myself to read the whole book.  Rachel was a weak baby, and I wanted to shake her and say, ""grow up"".  Talk about blind to anything around her.  Megan was a weak nympho.  It was a book that left you dissatisfied.",0,1,0,1,2,0,0,1,2,3
"829",-5.15,"If I had to describe this book in two words, it would be: cheap fiction. The book is mostly written from the perspective of a unreliable, despondent alcoholic mess of a human being. The prose was therefore equally unpolished, lazy, and uninspired. The story itself was somewhat suspenseful -- hence two stars instead of one -- but the resolution unfolds so quickly at the end that it makes you realize that the other 90% of the book was excess junk. Sadly this story could have been told in 30 pages.",1,0,1,0,0,2,0,1,9,1
"832",-0.8,"The Girl on the Train by Paula Hawkins is a psychological thriller.  Rachael Watson is the Girl on the Train and she is the main character.  Through her train trips we meet the other characters ; Tom (her ex-husband) and his new wife Anna and Scott and Megan.  These two couples are neighbors on the same street.  The first part of the novel rolls along rhythmically like the train on the tracks.  Once the crime has been committed the tension mounts and everyone becomes a suspect.  The mental illnesses run rampant is this novel and everyone seemingly has their own little corner on mental health. The most normal character in the story was Cathy Rachael's roommate.  I found myself comparing this to Gone Girl and The Rear Window.",2,0,0,1,1,0,0,2,3,3
"835",-0.6,"It is both frustrating and enticing to see Rachel's efforts to remember that fateful night. The night she was drunk (again) and a woman disappeared. Rachel meddles with the investigation... sort of... because she liked to watch the woman and her husband from her seat on the London train. Although a couple of houses away live her ex-husband and his new wife and baby, and she kind of stalks them, too. So much sorrow and confusion...I thought the novel was brilliant in depicting an alcoholic's struggle, on top of the ""whodunnit"" story itself. Rachel is both creepy and pitiable. As much of a ""loser hero"" as she was, I found myself rooting for her.My only disappointment came at the end, which was way too drawn-out and gore for my taste. Once we know who's done it, please, wrap it up. Otherwise a really good thriller.",3,7,2,5,6,4,2,6,5,7
"839",-0.25,"THE GIRL ON THE TRAIN is told from the first person point of view by Rachel, who imagines fantasy lives for people living in homes that she passes on the train. Living a restricted life, her daily train rides disguise that she has been fired from her job. As a heroine, Rachel is not particularly likeable. She has low self-esteem and is frequently so drunk that she has memory lapses, with one such lapse serving as a primary focal point.  Personally, the constant inebriation was overdone. Other characters, particularly the male ones, are similarly unlikeable. And when Rachel injects herself into the lives of those who had been fantasy characters, it's a bit much to accept. No doubt, this novel has become popular because of Ms. Hawkins' skill at slowly unraveling the many layers of this novel's central mystery: What happened to Megan?",0,2,0,1,1,2,1,4,2,5
"842",-0.75,"I read the whole thing because it was my book club's monthly choice.  The first negative is that the names and characters were very confusing and difficult to keep track of who's who.  This clarified after the first several chapters.  The second negative is that I didn't like the main character at all.  She was such a wimp and complainer!  I don't like being around negative, complaining people, so reading a book full of ""poor me"" was not fun or entertaining.  I also figured out ""who done it"" rather quickly, so it wasn't much of a thriller.  The writing was average, so I didn't have to suffer through poor sentence structure or grammatical errors.  I wish I had borrowed it from the library rather than spending money on it.  I deleted it from my tablet immediately after the book club meeting.",2,6,2,3,3,2,1,2,5,10
"844",-1.3,"If you are looking for a page-turner of a mystery, this is for you.  The protagonist, Rachel, has plenty of problems- out of work, divorced and alcoholic- and she rides a train every day to keep up the appearance that she has a job for her room mate, Cathy.  She watches a couple she does not know every day but sees their happiness and longs to experience the happiness she once knew.  But then the woman she watches disappears after a night where she was drunk and in the area and she cannot remember what happened.  The list of suspects grows and you can not be sure what happened as the layers of the characters are peeled back, one by one.  This is an intense psychological thriller that will keep you turning the pages for more.",1,2,1,1,2,0,2,2,1,4
"849",-2.35,"I've never wanted to bitch slap a story character so badly and i don't believe in violence.  I was rooting for Rachel but she was a hot mess.  Is it possible for a person to be that herp derp?  I cringed at her repeated socially awkward behavior and situations she put herself in.  Yes we have all been fools for love but Rachel groveled to new depths.  I am not familar with severe alcoholism but her constant blackouts became annoying.  I was hoping Rachel would adopt some real detective skills and her mission would inspire her to grow a spine but that never materialized.  The foundation of the story is enticing and I kept thinking any minute it was going to kick into overdrive, instead the book stayed in third grear grinding to a petered out finale.",8,2,3,3,3,4,1,4,10,7
"852",-0.1,"I started reading this book on an airplane; LaGuardia to El Paso. I was 80 percent finished by the time I arrived in Texas. I could not put it down. I vaguely recall airline crew talking to me: In case ofemergency...do you want something to drink...etc. I, however, was not flying on a plane but was instead, riding in a train. Thank you for this addicting read.",0,1,0,2,0,1,0,1,1,2
"854",-3.65,"This book reminded me of the classic ""Rebecca"" with the irreliable narration and tormented protagonist, except honestly this story was a bit more of a page turner, but this is mostly due to a style of writing more suited to a modern audience.If you are someone who has suffered abuse or suffer depression, this book is likely to be a trigger and may have a bad effect on you. Most reviewers don't think of such things.This was a very good book and I highly recommend it, I'm not one to go on analyzing a book. Let just say it will have an emotion impact on you. If you like your protagonists to be loveable and larger than life, you won't like this book, it is dark and perhaps just a little to ""real."" I see it compared to ""Gone Girl, and I get the similarity, this one requires much less suspension of disbelief.",2,2,3,3,1,4,2,4,5,4
"856",-3.25,"This was one of those books that is hard to review. All of the characters were horrible people, not a likable person in the bunch. But yet there were times I could not put it down, wondering what would  happen next.  Would I recommend it?  I'm not sure. It was different, but somewhat akin to Gone Girl. If you read that book, you will know what I mean about unlikable characters. A bit of a ""train wreck"" pun intended, several bad marriages, a drunk you just want to slap sometimes, mental abuse, it's got all that! If you like dysfunctional people, this book might just be for you.",5,2,4,4,0,3,2,2,5,2
"863",-1.25,"So glad these women didn't continue as pathetic victims. The unfolding of truth was well done. Anna was triumphant mad creepy at same time. She might be the character I would most likely to see if cashed in movie. Megan was so well scripted out... Sounded borderline personality or bipolar. Well done. The doctor ... Story of her past had so much potential for a thriller in itself. Great characters ... Lushes, cheats, narcissists. I didn't feel sorry for people too long which was a nice reprieve. Everyone was good and evil; except baby. Not sure if murderer was anything but a pathological liar gone socio path. Not a lot of good underneath it all. Liked it very much. Will miss no one though. Never want to see anyone again because it would be a nightmare that you would want to wake up from. Scary women.  Scary men. Evie has a legacy now.",3,6,5,4,4,4,1,5,6,7
"865",-0.85,"This book is so easy to read that before I knew it I had read for hours!! I wanted to gobble it down as fast as I could. The main character is an emotional mess and it can feel depressing in places, but keep reading! Written as stream of consciousness, you learn plenty about the characters consistently throughout the book.  There is a lot to know and the story opens like a rose, revealing the confusion, tension and mystery of the plot. It keeps you guessing who the victim will be, and then who the murderer is! Terrific ending!!",4,1,3,3,0,4,1,0,5,4
"871",-1.25,"I don't understand how this could be compared to Gone Girl.  ALL of the characters were unlikable, the story dragged on, and the ending was predictable. Don't waste your time. I gave it two stars only because I actually finished the book.",0,1,1,0,0,0,0,0,1,0
"873",-0.9,"The main character constantly enters into situations with no plan about what she is going to say or do.  It was very tiring reading over and over again, ""I know I shouldn't do this, but...."" and off she goes.  It was sad reading about someone with no self esteem and always so drunk she couldn't remember what she had done.",0,1,0,0,1,1,0,2,0,3
"874",-0.45,"It's hard to argue with the success of this book--millions of copies sold in several languages, a movie deal, and almost 44K Amazon reviews, so far. The story kept me hooked, and the author's storytelling was fresh and original, with characters whose personalities were revealed a layer at a time. I will say the pacing dragged a bit in the beginning, but once the story got going, I continued to read until the end. I felt empathy for the flawed protagonist, Rachel, who has been beaten down by life and finds it hard to cope. Not everyone finds life easy to navigate, and I rooted for Rachel to the last page.",1,3,0,0,2,0,1,2,2,4
"875",-0.8,"This story of The Girl on the Train is on suspenseful and adventurous ride. Turning this way, then that way; Hills and valleys. You think you have the perfect glimpse of a suspect only to be thwarted by another dark tunnel or turn. The perfect mystery.",0,2,0,1,1,1,1,1,1,2
"876",-0.35,"If Eric Bentley was right, and melodrama is fueled by the amount of fear it generates, then this is a successful melodrama. These women are all but literally tied to the train tracks in their shared London neighborhood. Their relationships are sharply rendered but shallow; there is betrayal, hand-wringing, abandonment, posturing villainy, and pathological obsession with all things superficial--body shape, real estate, reproductive success, chemical vice, and sexual virtue. Infidelity and sexual adventurism remain punishable by death (for women only). This story's twists and characterizations are so broad and archetypical that it could be told in pantomime. Luckily for us, it's told in really excellent prose; Paula Hawkins has a lot of fun with this problematic potboiler, and so did I.",6,5,3,4,5,5,2,4,8,8
"879",-1.35,"I purchased this book for a book club I joined and needless to say I finished it before the set date we were to discuss it. This story kept my attention from beginning to end. I loved how the story is told from the three women perspectives so you gain a full understanding of how they are connected. For a while I had a couple people in mind as the murders when I got closer to the end and realized neither of the people I suspected to be the murderer I was quite surprised. I read a couple reviews stating that they expected the story to end the way it did but I beg to differ. I didn't feel like this was a typical story of love and betrayal. If you do decide to read this book I honestly don't think you will be disappointed because I certainly wasn't.",3,2,3,1,2,4,1,1,4,6
"883",-0.4,"I started reading this book a few years back and I left it on the 3 or 4th chapter. When I saw that they made a movie of it. I decided to give it another try. I immediately remembered why I started reading it and I couldn't put it down. I wanted to unveil the secret and get to the bottom of everything. The book leads you one way and then it takes you another. Buy what I found most profound is the description of alcoholism and what people really go through. I really felt dizzy and frustrated and angry and Rachel at times. It was a very good book and I can't wait for the movie!",3,3,2,1,2,2,1,3,7,4
"890",-1.85,"Well written novel about a neighborhood in the London suburbs near a train where a murder takes place, and how the murderer is in plain sight, but not discovered until the end of the story.  The story is told from 3 different women's perspectives, even the one who is eventually murdered.",2,1,2,2,0,2,1,0,2,0
"891",-1.95,"The early reviews were right. Pick this thriller up and be prepared to plunge into its world of overlapping characters, well-placed red herrings and enough female angst to fill a shrink's office. Paula Hawkins' complex thriller is the book ""Gone Girl"" wanted to be but wasn't. (Sorry  ""Gone Girl"" fans.) Its heroine's alcohol addiction fuels her obsession with a house she passes daily on a train commute to London. Hawkins never quite lets us know if someone is heading for harm or salvation, and the imbalance is thrilling. Divided among three female characters, the chapters take the reader to the edge of one of two things - a purging reality or the embrace of unspeakable danger. Un-put-downable.",0,5,0,4,3,1,2,4,5,8
"901",-0.85,"This is a really interesting and well-written novel.It portrays a troubled alcoholic woman whose booze-induced actions and resulting amnesia are manipulated by other characters. The story centers around the disappearance of a young woman and the interaction among the protagonist, her ex and his wife, and the down-the-street neighbors. Much of the story occurs on the street adjacent to the rail tracks viewed from a train that the ""girl"" frequently travels.The carefully-timed character development perfectly allows the story to unfold and the suspense to build. The story is told from several characters' perspective adding to the plot and the personalities. The author's detailed picture of the personalities and the telling of the story my several main characters sets apart this murder mystery from most others.",2,5,1,2,1,1,4,0,4,6
"903",-0.15,"There are 5 main characters in the story and in each chapter, one of them is telling the events through their eyes - and so you have to remember the names and the dates are not consecutive, but jump back and then move to the present in the next chapter - her style of writing is a bit challenging; however, as the mystery unwinds, the suspenseful mystery builds and it gets harder and harder to put down.  The story starts out from the perspective of the girl on the train, who looks through the window and on the porch, watching glimpses of this couple, as the train makes a daily stop across from their house.  The story picks up the pace and pretty soon you will not be able to put it down.  There were a few graphical errors which made me go back and reread a few sentences, but it didn't detract from the story.  A great ride.",1,4,0,0,3,0,2,2,1,4
"907",-1.4,"At first, it was difficult to get into the story. A bit confusing and a lot of back and forth between characters and dates. Fortunately, for me, there were only three character's point of view. I finished the book in three days. The first day was arduous, but once I started again, the second day, it was almost challenging to put the book down. Finally, on the third day, I couldn't stop until I finished it. Surprising twist at the end and at times I suspected it could be..., but then thwarted the idea of it being so. Definitely a great, suspenseful read.",0,1,1,1,1,0,2,1,1,1
"908",-1.9,"Much hype about this book.  The interaction of all the characters was improbable. While it is fiction and a snapshot of a time in space, none of the characters were particularly likable or realistic.  Hard to find much empathy for or identification with any of them. I know alcoholics with some of the devastating results experienced by Rachel.  Not sure people ""recover"" their memory or black-outs as quickly and clearly as Rachel.  But it would be a very long book if in the real world. The two babies in the book, one living, one deceased, were the ones for whom I felt anything except vague annoyance.  Imagine attempting to navigate such a self-absorbed adult world.  While the book moved quickly, ultimately I was disappointed.",3,4,3,1,0,4,0,3,7,5
"910",-2.9,"I was so disappointed in this book.  The characters were sad to read about and the plot line was horrible.  I would not call this a ""thriller.""  It was more a sad commentary about self destructive behavior.",3,0,3,2,0,1,0,0,3,0
"917",-1.95,"I like that the killer is totally someone different than you'd expect and that it is written from three perspectives. Would definitely recommend hardcover or paperback rather than kindle as the dates bounce around. It was a little hard to read about the constant drunkenness and alcoholism, and this made it a little frustrating in the first half from Rachel's perspective, because all I could think was get it together! But as someone who is trying to understand the disease of alcoholism and addiction for a family member in my own life it was helpful to sort of see their struggles, self-loathing, and first hand disease. It sets the book up brilliantly as to how/why the killer did what he did. Excited to discuss at book club.",2,2,3,2,2,2,2,5,5,5
"918",-1.3,"It took awhile for me to understand the narration.  Just who was this Megan person anyway?? It was trying to read about an alcoholic who would voice the right things to do yet she would always do that which would damage her.  She really had no life of her own and lived in the past, bothering her ex husband and his wife, acting as if she were commuting work daily to avoid criticism from her landlord/roommate, dreaming about those people she saw in her old neighborhood as she rode the train.It seems the rambling thoughts and actions would go on forever and without purpose.  Finally the fragmented thoughts and storyline started coming together and suspense began to build.  The last half was a good story but I did question myself for many pages as to why I was still reading this book.",3,6,2,2,2,3,3,2,5,5
"919",-0.9,"Great read for my cross country flight, it's a page turner or Kindle tapper to be more accurate. I doubt much of the story or characters will stay with me for long except for the alcoholic Rachel. As with any mystery if you figure it out too early on the rest becomes tedious. For me that was the case with this book and then suspense turned into impatience. But on the other hand if I hadn't been able to somewhat figure it out on my own I would have felt it was an ""unfair"" mystery so all good in the end!",2,4,1,4,1,4,3,3,6,3
"922",-1.5,"So many twists and turns.  So many screwed up personalities. I felt it was depressing from the get go.  The more I read the more the personalities become more screwy.  Not a feel good read.  More like pathetic lives getting more pathetic.",1,1,2,0,1,2,1,1,3,1
"925",-0.25,"After all the hype, I was expecting more mystery and drama........sort of a nail-biter. But it's not that kind of book. It's more about what goes on in several character's heads, especially the main woman. It was just okay.",0,3,0,0,1,0,1,1,1,2
"931",-2.9,"After first hearing Paula Hawkins on NPR last year, I knew I had to read this book myself.  The problem was that it was too far down on my TBR pile for me to get to it anytime in the near future.Last night, however, I finished it.  I couldn't stop with ten pages left! I had to know!  I wasn't suspect of the killer the whole length of the book, so kudos.  Thank you for writing a page turner. For me, it was never dull at all. I will just have an extra shot of espresso in my coffee now that I stayed up too late finishing this one.Highly recommended!",1,0,0,4,1,4,1,0,6,2
"934",-0.4,"I was disappointed given the large number of stars many readers gave this book. I think 3 neurotic characters is way too much for a story - I felt like I was bouncing back and forth among the storied women and none of them evolved into a substantive character.",1,0,2,1,0,1,0,0,2,1
"943",-4.55,"I read this for my book club; otherwise I don't think I would have read this on my own. The book was too much of a downer for me. All the women's stories are pathetic and tawdry, and they seem clueless about how to improve their circumstances. I don't like reading woman as victim stories, and this one is no exception, even when two of them get past the hatred for each other and team up to expose a killer. The book is well written and the plot is suspenseful, but the ending is rather predictable. I didn't understand what all the hype was about and sorry to say, I still don't.",2,3,2,3,1,3,0,2,4,2
"947",-5.25,"This was for book club and we were all in agreement - utterly forgettable beach read. As this book was compared to Gone Girl and Rear Window we went in with high hopes. Unfortunately, you have three unsympathetic, unlikeable women who are unreliable narrators with similar voices, and the two-dimensional dysfunctional men in their lives. I figured out the murderer about two-thirds of the way into the book. The ending is nothing short of unbelievable. The one thing the author does get right is that alcohol-driven black outs are not caused by the failure to remember, but the brain’s failure to transfer events from short term to long term memory. She then discards this fact when her plot’s stuck and she needs Rachel to remember something in order to end the story. A very disappointing read.",2,1,2,2,1,4,0,4,9,2
"948",-1.5,"What a miserable waste of time and money! There is virtually no story line--just the rambling, disconnected thoughts of some miserable soul. I quit reading a quarter of the way through--utterly boring. (And as an English major, I will read most anything, including the back of cereal boxes, most of which are more entertaining than The Girl on the Train.",2,3,2,0,2,2,1,1,6,5
"953",-2.6,"This is not my usual genre, but I am so glad I read it. Ms. Hawkins, you are phenomenal,####spoiler alert###I was so confused, I actually thought Rachel did it. I was like damn she was so angry about about Meg cheating on Scott she killed the B, and what the hell did Meg sleep with the psychiatrist??? And Anna, so vapid until the end then wham!! She is just as crazy as the rest of them and you realize the only same one is the drunk. The ending is not happy, not really. But its the only realistic way it could have ended.",4,3,3,2,2,3,0,2,5,4
"955",-5,"I knew this story was not going to be pretty; after all, the main character is a pathetic drunk and a compulsive liar.  Every person in this sordid little drama has something to hide, and the book is written in such a way that the hidden parts don't fit together 'til the very end. The rotating viewpoints got to be tedious and confusing, especially since I wasn't able to read many chapters at one sitting. If you read this novel as an e-book, the repeated chapter headings with the same names will make it difficult to keep your place in the story line. I agree with many other reviewers; there was not a single character in this book that had any redeeming qualities. That said, I can't say I hated it; they all got exactly what they deserved from each other, as a bunch of scheming, selfish, violent liars.",3,1,5,4,1,2,1,1,7,4
