"","sentiment.score","ReviewContent","anger","anticipation","disgust","fear","joy","sadness","surprise","trust","negative","positive"
"1785",-4.25,"Don't be lulled into a false sense of security. Like the slow click of roller coaster wheels climbing up their first steep incline, this book starts slowly, lost in the mind of one woman whose tragic life is submerged in the blurring haze of alcohol where fantasy becomes easily confused with reality and self-pity comes as easily and frequently as fear and doubt. Then, just when the reader is beginning to feel this book might be moving just a little too slow to be worth finishing, the coaster reaches its peak. What follows is a hurtling descent full of twists and turns that will leave you gripping, white knuckled, into the wee hours of the morning.",1,1,0,4,1,5,1,3,6,5
"1789",-1,"Being strapped to a chair for hours and forced to watch abandoned and abused puppies staring sadly out of cages while Sara MacLaughlin sings Arms of The Angel would be a cheerful experience by comparison.  But the twists and turns made for a good read.",1,3,0,3,3,2,3,2,4,3
"1791",-0.45,"I was sooo excited to read this book after all of the great things I heard about it.  It took me a couple of tries before I was in the right frame of mind to read it.  For me, there was too much of the book wrapped up in how drunk and miserable she was.  This part got old fast and made the story drag on.  I guessed who the villain was way before the end of the book.  I think I would have liked it more if the main character, Rachel, would have made more attempts to improve herself throughout the story, even as she was embroiled in her obsession.  Her pathetic nature just kind of overshadowed the whole book for me.",1,2,2,1,3,2,1,3,4,4
"1794",-2.5,"""The Girl on the Train"" definitely had it's ups and downs. The main character - an alcoholic spending half the book in a drunken stupor - was infuriating, frustrating, and downright depressing. There were times where I felt truly sad for her, and others where I rolled my eyes at her terrible decision making. There are only a few characters in this novel at all, and none of them are likable. The plot had a lot of promise, though the end was more of an over-dramatized Lifetime movie and less ""Gone Girl"". It was a fun read, but nothing that shines in terms of mind-blowing twists and turns or characterization.",1,1,3,1,2,2,0,2,4,3
"1798",-3.1,"Let me start by saying I did not like this book at all, but I did not like Gone Girl, either.  It may be I just don't like these types of psychological thrillers.  The characters in this book are so far-fetched, it's hard to believe they would really exist.  The women seem unable to run their own lives and the men have violent tendencies.  The book is a classic whodunnit and I kept reading because I wanted to see how the author wrapped it up even though I figured it out earlier in the book.  Also, I found it difficult to distinguish between Rachel, Megan and Anna as the story bounced back and forth from their perspectives.  The author gave them all the same 'voice' since her writing style was the same between all three characters.  I often had to go back to the beginning of a chapter to see who was narrating that particular chapter.  At times, the book dragged and the ending was ridiculous.  I don't understand the hype about this book, think I'll stick to historical fiction!",2,2,2,2,1,1,1,2,4,4
"1802",-0.5,"I think I'm one of the few who wasn't impressed. To have each chapter told from someone else's POV, each character needs to have a different ""voice"". All of the females in this story sound the same. You really had to make sure you knew exactly who's mind you were in at all time or you will be confused. Also, all of the characters had very generic names that made it very hard to distinguish who was who.With such great reviews and having not heard one bad thing, I was disappointed. Good intriguing story but generic characters.",2,2,2,1,1,2,1,1,2,1
"1808",-3,"The Girl on the Train, by Paula Hawkins, has been on the best seller lists for more than a year now, and I understand why. I’m not a fan of first person present tense narration, and there are three such narrators in the book, all of them undependable. The characters spend the entire book lying, cheating, and fantasizing. Terrible secrets are revealed and hearts are broken. This is not a feel-good book. But it is fascinating and difficult to put down, and I recommend it.",3,2,2,3,2,2,2,3,3,4
"1809",-0.5,"I wanted more. I was able to figure out what was happening too early. I thought the book was over hyped. Not a bad read but I guess I wanted something with more depth and hooks. I get annoyed at books that jump from character and different points in time. There are better ways to build suspense and plot. Almost seems like a way to avoid writing a deeper and suspenseful novel. Just jump from character to character at random points in time to confuse the reader. I guess I better start working on my great American novel.",1,4,1,3,1,1,2,1,3,5
"1810",-0.95,"This was an interesting read told from he perspectives of three women. One, the protagonist, is a depressed alcoholic who watches people from her seat on the train and makes up her own observations of their lives. The other two women are the ones that the Girl on the train observe each day. They are all connected, as the story unfolds, and we are taken through their daily lives to discover something terrible has happened to one women. The girl on the train immerses herself into the situation to a point of risking her own life.An enjoyable read for mystery lovers.",2,2,1,2,0,2,1,0,2,1
"1812",-0.75,"I know this is billed as a psychological thriller.  I cannot understand its maintenance at number one on the best sellers list.  I found the first two thirds of the book slow, boring with totally unappealing women characters.  It was not until the last third of the book that it picked up in solving the murder, even if the characters, now including the men, were still ridiculous, unsympathetic and the murderer became clear way before the ending.  I only stuck it out because people I know told me how wonderful the book was.  Won't take their reading recommendations any more.",4,0,3,2,2,2,2,3,5,4
"1816",-0.0499999999999999,"The beginning of this book was tiring for me and the main character was disgusting. This was a book club read and my recommendation so I trudged along.  The one thing that was very clear early on was the author's ability to make you feel as though the events were happening to you; I think that's why it was so difficult at first.  However, this is one of the best fiction novels I've ever read.  I will attempt to find other books she has written.",1,1,1,2,0,0,0,0,1,2
"1820",-0.15,"Great book that kept me guessing! Each time I thought I knew what happened to the missing girl they threw something in to change my mind! Near the end I figured it out but still a great time reading this. Was often hard to put down!",0,2,0,2,0,1,0,0,1,1
"1821",-1.3,"I was looking forward to this book, highly recommended.  I found the women to be portrayed as weak, crazy and lusting for men who were obnoxious and controlling. Even the therapist was of poor character.  The storyline picked up near the end, but wasn't enough to compensate for the stereotypical roles.",2,1,1,1,2,2,1,2,2,3
"1822",-1.1,"A cleverly constructed story written from the perspectives of the three main female characters, Rachael, Megan, and Anna.  Rather than numerical chapters, each chapter is named for whomever happens to be telling the story from their point of view at the time.  This transforms into a gripping and exciting yarn about love found, then tragically lost.  It touches upon the insidious and hopeless consequences of alcoholism, infidelity, and ultimately cold and calculated murder.  This is not a happy story with a fairytale ending.  It left me feeling glad it was over but satisfied I stayed with it.",5,6,5,6,7,6,3,3,8,10
"1825",-4.05,"This book is convoluted and extremely difficult to follow since it constantly changes point of view. Also, it is poorly edited allowing glaring sentence structure errors, such as fragments. i cannot recommend it either since it is really very trashy..",2,1,2,2,0,1,0,3,4,2
"1828",-2.05,"Buzz from my peers said this book was a hot ticket, and had a surprise ending that would leave you shocked.Well, it may have been hot at one time, but the so-called surprise ending was flat. In retrospect, there were many misdirections and red herrings littering the tale. Story lines never fully developed and introduced characters left dangling. The different narratives from the women was at first interesting, but later grew tedious, as they kept doing, saying, thinking the same things.The male characters were almost indistinguishable except for the exotic doctor. Another red herring. Like the red-haired guy on the train.SPOILER ALERT! Do not read on if you've not read the book:There are 5 main characters and one of them was the murderer. No shock there. What's shocking about that? I mean, shocking would have been that all three women turned out to be the same person? With the way the dates jumped around, it could have been possible. Or perhaps Megan never died--It was not her body. She was just starting life over somewhere else? Or perhaps the baby, Evie, would be the killer? THAT would've been shocking! But not the dull ending, where a drunk lady starts to remember stuff. Ho hum. Tremendously long-winded build-up to a klutzy, quick finish.Not worth the hype.",3,4,1,5,2,4,3,2,7,12
"1829",-1.3,"Too much hype. I really expected more. Modern day women allowing themselves to be abused by men. Sorry, I don't see how this book received any good reviews. It was difficult to finish and a disappointing ending.",0,3,0,1,1,1,1,1,2,2
"1833",-0.15,"After reading the plot synopsis, I was excited at first to read The Girl on the Train. Once I started though, it seemed as if I read the same descriptions and the same dialogue over and over again. I get that it's called what it is and the protagonist does spend an inordinate amount of time not only on the train, but also rehashing, in an interior monologue, situations that she has experienced time and time and time again. I finished it but the ending was not only predictable but a disappointment.",0,2,2,0,1,1,1,3,1,4
"1837",-0.25,"This was similar to many books I've read which start out well-written and captivating and which lose momentum about halfway through.  I had to force myself to finish it.",2,2,1,2,0,1,1,0,3,2
"1838",-0.5,"Scary book; liked it; kept you on the edge...a bit difficult to follow",0,0,0,1,0,0,0,0,0,0
"1839",-0.1,"The novel is based mainly in Rachel, a commuter on London's rail line. As she travels passed the home she once shared with her husband, she can't help but wonder about the residents she sees outside their homes, and how her lonely life and vivid imagination add to the evil that occurs at 15 and 23 Blenheim Street.",3,1,2,2,1,2,0,0,3,1
"1841",-5.65,"Rachel Watson is a down-on-her-luck young woman who rides the train in and out of London every day to hide the fact that she has lost her job from her roommate, and to maintain a tenuous link to what she once was: gainfully employed, happily married and sober. One particular house near the railway tracks fosters an increasingly unhealthy obesssion in Rachel on these daily trips, with its seemingly perfect couple who sit on the terrace. Is it a secret longing for what Rachel once had? Or something more forbidding, something on her own emotional doorstep?With its Hitchcock like setup and close similarity to Gillian Flynn’s work, ‘Girl on a Train’ opens with this compelling story question. Then Rachel’s blurred recollection of a crime she witnesses in a drunken stupor causes her to stumble through the lives of others, wreaking havoc on ex-neighbors, her ex-husband, and aggravating the police, who soon lose patience with Rachel’s drinking and lies. You may actually find yourself doing the same as she keeps hitting the bottle.But ultimately ‘Girl on a Train’ disappoints. It just can’t live up to its promising start.If ever there was an unreliable narrator, it’s Rachel.And this is part of the book’s problem: The reader is too often misled into feeling one way about a character, only to have it not be so. The mystery itself relies too heavily upon Rachel’s opportune blackouts, taking us to the edge of discovery only to learn that she just can’t quite remember what happened. Until she does. And then the murderer does something so dumb (keeping a key piece of evidence any killer worth their salt would surely have gotten rid of) that it violates the ‘maximum capacity’ rule of a worthy villain. He/she also manages to give the clichéd, expository summing up toward the end of the book, explaining in detail the crimes committed and the motives for committing them.Like Gillian Flynn’s books, the parallel to ‘Girl on a Train’ is apparent: multiple narrators switching back and forth in first person as the crime unravels, everyday people living lives of quiet desperation, marriages that appear to be perfect but aren’t. But whereas Flynn’s writing can soar, and her characters are rich and nuanced, Paula Hawkins’ prose is deliberate and too ordinary to make us want to spend so much time in her character’s heads. There are clarity issues in the story telling as well, not helped by the fact that all three narrators are young English women of the same age, same class, with similar backgrounds and voices.Girl on a train is a solid suspense read however, although mystery buffs will find themselves want more.",7,12,5,12,6,9,6,10,19,23
"1842",-3.35,"I thought this book was dark, depressing and ended poorly.  I also do not think think the author described the characters at all.  I had a hard time connecting to the characters and getting a visual image to go with their story.  I wasted a few hours of my life....",1,2,2,0,0,2,0,1,3,1
"1844",-2.9,"If I'd have watched it as a movie I wouldn't feel so bad about wasting my time reading it and it would have been the same.  The characters did not have much depth to them.  No surprises in this book one knew who the killer was from the beginning.",1,1,2,2,0,2,0,1,2,2
"1845",-2.3,"The Girl on the Train is the perfect thriller to read on a trip--it's quick and easy to read, it's intriguing, and it keeps you guessing.I have to say, Hawkins has done a great job at creating a slew of characters to dislike. I don't mean that as a bad thing, though. I thoroughly enjoyed reading a book where I felt like I was my own detective, trying to solve a mystery where I couldn't even trust the narrators. There was some type of a plot twist around every corner, and in the end, I was very much satisfied by the climax and conclusion Hawkins created. (I'll add a quick caveat here that there was one part of the story towards the end about one of the character's backgrounds that is so quickly explained, that it felt like an afterthought thrown in for necessity, but not development--that was disappointing).The only major complaint I had about this book was that so much of it felt unoriginal and cliche to me. The characters were somewhat dull: Rachel is an alcoholic, Megan is a restless obsessive, and Anna is a narcissist. But very little of each of these character's traits were developed further. And the men in this book were so black-and-white that I sort of pity any man who reads this book because the stereotypes are so plain to see--the men are either doting, kind-hearted lovers or oppressive, jealous villains.But then again, maybe these cliches were exactly Hawkins point--to make the setting and characters so ordinary that it made the story just that more chilling.",5,4,4,2,5,7,3,5,8,8
"1846",-0.95,"Characters were too depressingly crazy to really enjoy this.  The characters were awful people in Gone Girl, but you didn't really know how bad until later - and then it was entertaining how awful they were and had it some darkly funny bits.  Nothing funny here.",3,2,2,3,2,3,0,1,3,2
"1851",-2,"Much ado about nothing. Don't know what all the uproar was about this book. After all the great reviews and the endless array of character analysis books this one just became drudgery. Characters mundane and very little to grab ones interest. Must be boring to live in the British countryside if this is what the neighbors are like.",2,0,0,1,1,1,0,1,5,3
"1854",-0.65,"Poorly written book that only has characters that are mentally unstable ..Not worth the money or time to read it , mixed up story that is dragged on and on ..As you can imagine with unstable characters the book makes little sense , I feel that the author had mental issues also , that came out loud and clear ...",1,2,0,1,1,0,2,2,2,4
"1856",-0.85,"This basically seems to be about two young women, one of whom views where she used to live from the windows of a train which stops at a signal every day when she is aboard.  The other lives there  In the end one gets murdered by a friend and the other stabs the murderer with a corkscrew.Have to admit I skipped a lot of the book.  Not really my kind of book.",1,1,1,1,3,1,1,2,1,3
"1863",-1,"An agonizing read...none of the characters are likable.  Their soul-searching is non-stop and painful..  Perhaps that contributes to the suspense, but for me, it just made me want to finish the book and leave these people behind.  I did enjoy the occasional glimpses of life in England, but they were few and lacking in detail.  A good book for lovers of introspection and wallowing in sell blame..",2,3,2,3,2,2,4,2,5,2
"1867",-0.45,"Fast-paced, confusing at first until all the pieces start coming together, then thrilling and finally chilling! It was hard to stop reading. I flew through the pages barely reading each word. I didn't want it to end but was anxious to know how it ended! I enjoyed reading about the same days from the first person narratives of three women, although at first I felt the need to page back to check dates as each woman reported events from her own perspective. Don't do that. It will come together on its own and the dates will inevitably make sense.  I can't wait to see the movie!!",0,6,1,1,2,0,2,2,2,5
"1873",-1.95,"This is a really good book, difficult to put down. Easy to read, but not dumb. Lots of comparisons to ""Gone Girl"" but I was reminded of ""The House of Sand and Fog"" in that humans can invite real tragedy just through selfish behaviours or the fog of addiction.",1,2,1,2,2,1,2,3,4,3
"1883",-2.05,"The book is well written and edited. No complaints there. But for the most part, it's painfully boring.  The entire story could be told in fifty pages, but the author takes three hundred before making it interesting.The main character is another issue. Pathetic and uninteresting. A loser from beginning to almost end. I would not recommend this book.",0,0,1,0,0,3,0,2,4,4
"1884",-0.9,"This author keeps the reader engaged. The story jumps back and forth in time and from character to character but not in a confusing way. Informative regarding the behaviors of one alcoholic and one pathological liar.",0,2,1,0,1,0,0,2,1,3
"1887",-0.45,"This book felt like it was written quickly with the rhythm of the train grinding to and fro between London and Witley always rumbling past in the back ground. The persistent English rain relentlessly drenches the suburban street where the action unfolds between two sets of couples all of whose lives and in some cases deaths are intertwined with Rachel - an ex-lover - the unfortunate jilted lover watching it all happen from the passing train.Quite similar to Gone Girl in style of writing - maybe they'll make a movie of this one too.",0,2,0,0,1,1,0,2,2,4
"1891",-0.5,"It was very difficult getting into this book. It did nothing until about 2/3 of the way through. Even when I thought something was going to happen and piqued my interest, it fell apart and did nothing. The book was dull, laborious, and even the ending was so-so. I DID manage to finish it though just to see if it would improve, so I give myself credit for that.",0,3,0,1,1,2,0,3,3,4
"1899",-0.5,"This story will shake you to your core. I absolutely couldn't put this down. Whatever you think you know, or remember will only seem like a dream when you come to the last page of this thrilling, nightmarish story. You won't look at people or their lives the same way ever again. If you're looking for some thing to get lost and carried away in, look no further. Anna will tell you what happened that day on the train.",0,1,0,0,1,1,1,0,1,2
"1907",-1,"I don't see what the hype is about. The ending left me dead inside. I hated every character they were all very flawed in there own different way and I didn't like any of them. At the end it got hard to keep going because I didn't like any of them and didn't care how it ended. However, i did think the beginning was a page turner. I thought the ending was pretty obvious.",0,3,0,0,1,0,0,2,1,2
"1908",-0.4,"You wouldn't know 'who dunnit ' until the end of the book, which is great, but this book didn't live up to its hype. Too vague in the beginning and only after a third of the way through dos I realize each section was written from one of three women's perspectives. To be fair, that may be because I was reading on Kindle and no fault of the author. It's an 'okay' read, nothing to write home about in my opinion <f0><U+009F><U+0098><U+008A>",0,1,0,0,0,1,0,1,3,3
"1910",-0.25,"While I don't particularly like a diary format to a novel, this allowed the reader to be able to see the different points of view of the major characters. The main character had to work out her own issues with depression and alcoholism to be able to attempt a normal life. Her imagery of the people's lives outside the train lent for an interesting murder mystery, all the way to the end.",2,2,2,2,1,3,2,1,3,5
"1911",-0.05,"This is the first time I have read a book where I have truly disliked all of the characters until nearly the very end. Readers will appreciate the characters' development if they stick it out. Despite my dislike for the characters, the story kept me engaged and wanting to know what would happen next. I'm always pleased when the author does a good job at misleading you about the ending.",3,4,2,0,3,2,1,3,4,5
"1921",-1.25,"Not able to pinpoint why, but this book just did not hold my attention. I think the life of a woman with a drinking problem and depression just did not interest me. As in real life, the self absorption of the alcoholic is boring.",0,0,0,1,0,2,0,1,4,3
"1925",-4.2,"The Girl on the Train asks questions that our society shies away from. How important is it for a woman to be a mother? If someone cheats, who is to blame? Should an alcoholic be trusted and how much is too much?Rachel tries unsuccessfully to put her life together after her marriage crumbles. She rides the train to and from London everyday, caught up in her thoughts and swimming in the aftereffects of a night of drinking. The train always stops at a row of houses, where Rachel sees Jason and Jess living out their romantic lives. Rachel witnesses an argument between Jason and Jess and the next morning Jess is reported missing. Rachel is thrown into the mystery surrounding Jess’ disappearance while clashing with the lives of her ex-husband Tom and his wife Anna.A cast of suspicious characters make an appearance as Rachel works to discover the murderer. Though the killer’s identity is well hidden, the story reads less as a “who done it” and more like a sympathetic narrative of a suffering woman tossed around by circumstances. I identified with the struggle of the three different narrators, their ugliness ringing as true as their virtues. This is a great summer read and will keep you up as you rush to discover the ending. It is definitely worth missing sleep at night!",7,5,4,7,4,7,1,5,13,6
"1930",-0.75,"I read this book mostly because I like to read books that are about to become a movie and feel like I've beaten the suspense of waiting for it to come out! anyways, I don't know what all the big fuss is about! I mean it's a good story and all, I didn't see that ending coming but I started to figure it out about 3/4 of the book. I got the audiobook version so the listen is always good! I get a good sense of the characters by who is doing the dialogue. I just felt like the story was being dragged on! I feel like it could've been shorter and we still could've gotten the same ending! I mean I get it! She's a terrible alcoholic but it just kept being dragged on and on! But again this is not my typical read, so for what it was worth it was ok. I think you'll be ok if you just want to wait for the movie though!",2,4,1,2,1,2,2,1,3,3
"1931",-0.25,"I started to read the book and thought this is slow to start. As you get to know reach character you feel their emotion. It pulls you in chapter by chapter till you discover who is the killer. Excellent read",0,2,0,0,1,0,0,1,0,1
"1933",-1.7,"I don't know why everyone thinks this book is so great! After months of hearing how smashing this book is, I finally bought it and was bitterly disappointed. The main character is a jerk. Not because she's an alcoholic, I have compassion for that, it's because she's really unlikeable. I hated this book. My husband got 25 pages in and deleted it, he disliked it more than I did.",4,1,3,2,1,3,2,1,4,3
